{
  "analysis": {
    "analyzer": {
      "model": "repository-session-adapter",
      "name": "codex-human-reviewed-visual-observation",
      "observedAt": "2026-08-23T16:40:00Z",
      "type": "hybrid",
      "version": "1"
    },
    "capabilityClaims": [],
    "patterns": [
      {
        "category": "layout",
        "id": "PAT-DD-DECISION-HIERARCHY",
        "identityElements": [],
        "implementationImpact": "visual-only",
        "keywords": [
          "decision-first hierarchy",
          "primary evidence action"
        ],
        "name": "Decision-first information hierarchy",
        "observation": "The governed run, promotion boundary, and primary evidence action appear before supporting implementation detail.",
        "productRelevance": "Design Intelligence must keep evidence and authority boundaries legible before exposing operational detail.",
        "proposedUse": "Preserve decision-first hierarchy in Design Intelligence control and evidence surfaces.",
        "recommendedDecision": "ADOPT",
        "requiredCapabilities": [],
        "riskFlags": [],
        "source": "http://127.0.0.1:8123/",
        "whyItWorks": "A hurried operator can identify the run state, consequence, and next action without scanning every subsystem."
      },
      {
        "category": "layout",
        "id": "PAT-DD-STATUS-ACTION",
        "identityElements": [
          "fixture typography",
          "fixture warm grid",
          "fixture red-green palette"
        ],
        "implementationImpact": "visual-only",
        "keywords": [
          "status-near-action",
          "evidence summary"
        ],
        "name": "Status-near-action evidence summary",
        "observation": "The evidence receipt keeps contract, viewport, accessibility, and baseline state directly above the inspection action.",
        "productRelevance": "Generated evidence packs and mission handoffs need compact state summaries without becoming another dashboard.",
        "proposedUse": "Adapt the status-near-action grouping through the repository's existing contract and evidence-pack formats.",
        "recommendedDecision": "ADAPT",
        "requiredCapabilities": [],
        "riskFlags": [],
        "source": "http://127.0.0.1:8123/",
        "whyItWorks": "The operator sees the consequence and its supporting state in one bounded region before taking action."
      }
    ],
    "schemaVersion": 1,
    "sourceEvidence": [
      {
        "artifacts": [
          {
            "kind": "screenshot",
            "path": "artifacts/design/references/design-department-surface/reference.png",
            "sha256": "0944913675ff53f0c28eec91477fa1fc0144ba0cdb011c32d2a1251e478c3f01"
          },
          {
            "kind": "dom-capture",
            "path": "artifacts/design/references/design-department-surface/page.html",
            "sha256": "57f8d89ddd0d42adf2cf0c8eeb38a050e0ae66371ef6bd1d9bac01dbcbcbacdd"
          }
        ],
        "source": "http://127.0.0.1:8123/"
      }
    ]
  },
  "authorities": {
    "duplicateAuthorities": [
      {
        "authorities": [
          "docs/ARCHITECTURE.md",
          "docs/architecture/ADR-0001-development-control-plane-facade.md"
        ],
        "capability": "architecture_overview",
        "note": "Capability appears to have more than one active authority.",
        "severity": "P2"
      }
    ],
    "root": "/home/administrator/design-intelligence",
    "sources": [
      {
        "authorityClass": "repository-governance",
        "enforcement": "instructional",
        "id": "AUTH-58E3DF5505D5",
        "kind": "agent-governance",
        "path": "AGENTS.md",
        "sha256": "a08b586d3b098927c3ade6b782342c8d1325dcc8ce7ae61c6272a2ce29866755",
        "statements": [
          {
            "line": 3,
            "status": "scoped",
            "text": "This repository owns the reusable utility itself. It does not outrank consuming repositories."
          },
          {
            "line": 7,
            "status": "scoped",
            "text": "- Design intelligence is the primary mission; repository intelligence is supporting infrastructure."
          },
          {
            "line": 8,
            "status": "scoped",
            "text": "- Existing repository authorities outrank package defaults."
          },
          {
            "line": 9,
            "status": "scoped",
            "text": "- Read-only by default. Only write artifacts when an explicit output path or installation target is requested."
          },
          {
            "line": 10,
            "status": "scoped",
            "text": "- `design-intelligence \"<task>\"` is the canonical front door; preserve its simple current-directory default."
          },
          {
            "line": 11,
            "status": "scoped",
            "text": "- A recommended design direction is not approval. Implementation requires explicit direction selection."
          },
          {
            "line": 12,
            "status": "scoped",
            "text": "- Supplied references remain `RESEARCH_REQUIRED` until observed patterns and transformations are recorded."
          },
          {
            "line": 13,
            "status": "scoped",
            "text": "- Prefer knowledge alignment over runtime migration when it captures most of the value."
          },
          {
            "line": 14,
            "status": "scoped",
            "text": "- Do not add a second component system, second token system, second backlog, or second E2E hierarchy."
          },
          {
            "line": 18,
            "status": "scoped",
            "text": "- `design_intelligence/`: vendor-neutral core package and CLI"
          },
          {
            "line": 19,
            "status": "scoped",
            "text": "- `.design/memory/`: canonical append-oriented decision, outcome, exception, debt, and component records"
          },
          {
            "line": 20,
            "status": "scoped",
            "text": "- `.design/quality/`: governed deterministic thresholds and score history"
          },
          {
            "line": 21,
            "status": "scoped",
            "text": "- `.design/baselines/`: approval-bound visual baselines; never update silently"
          },
          {
            "line": 22,
            "status": "scoped",
            "text": "- `scripts/design/`: Playwright QA, repair proof, and tiered CI orchestration"
          },
          {
            "line": 23,
            "status": "scoped",
            "text": "- `tests/design/`: route-specific scenario definitions; do not create a parallel product E2E hierarchy"
          },
          {
            "line": 24,
            "status": "scoped",
            "text": "- `artifacts/design/`: contracts and generated evidence packs"
          },
          {
            "line": 25,
            "status": "scoped",
            "text": "- `repo_fit/`: V0.1 compatibility wrappers"
          },
          {
            "line": 26,
            "status": "scoped",
            "text": "- `skills/`: concise skills plus reference docs"
          },
          {
            "line": 27,
            "status": "scoped",
            "text": "- `templates/` and `examples/`: reusable design artifacts and product profiles"
          },
          {
            "line": 28,
            "status": "scoped",
            "text": "- `adapters/`: thin Codex and Claude adapter guidance"
          },
          {
            "line": 29,
            "status": "scoped",
            "text": "- `devctl.yaml` and `.dev/`: control-plane index and bounded task packets; never a second design authority"
          },
          {
            "line": 30,
            "status": "scoped",
            "text": "- `docs/`: architecture and release notes"
          },
          {
            "line": 31,
            "status": "scoped",
            "text": "- `tests/fixtures/`: bounded proof repositories and manifests"
          },
          {
            "line": 35,
            "status": "scoped",
            "text": "- Run `npm run design:ci:quick` for core and governance changes."
          },
          {
            "line": 36,
            "status": "scoped",
            "text": "- Run `devctl validate` and `devctl doctor` after changing control-plane declarations or authorities."
          },
          {
            "line": 37,
            "status": "scoped",
            "text": "- Run `npm run design:ci:standard` for material rendered changes."
          },
          {
            "line": 38,
            "status": "scoped",
            "text": "- Run `npm run design:ci:full` before a V3 release."
          },
          {
            "line": 39,
            "status": "scoped",
            "text": "- Run the skill validator for each skill before tagging."
          },
          {
            "line": 40,
            "status": "scoped",
            "text": "- Keep `VERSION`, `pyproject.toml`, and `design_intelligence/__init__.py` aligned."
          },
          {
            "line": 41,
            "status": "scoped",
            "text": "- Automatic repair stops after 3 iterations or at authority, scope, architecture, baseline, threshold, test, backend, or product-behavior boundaries."
          }
        ]
      },
      {
        "authorityClass": "architecture",
        "enforcement": "documented",
        "id": "AUTH-FD97592712BB",
        "kind": "architecture",
        "path": "docs/ARCHITECTURE.md",
        "sha256": "70588829392edf063eb3c9d4b56abfb70d775ba62a75032e22b68c2e51e8f96b",
        "statements": [
          {
            "line": 5,
            "status": "current",
            "text": "```text"
          },
          {
            "line": 6,
            "status": "current",
            "text": "plain-English task -> repository context -> inferred surface mode -> three direction briefs"
          },
          {
            "line": 7,